{
  "activation": {
    "reasonCodes": [
      "UPSTREAM_VERIFICATION_PENDING",
      "DESTINATION_MIRROR_PROOF_MISSING",
      "LAB_SIGNATURE_MISSING",
      "MODEL_PVC_MATERIALIZATION_PROOF_MISSING",
      "DEPENDENCY_SECRET_REFERENCES_UNRESOLVED",
      "DEPENDENCY_TLS_REFERENCES_UNRESOLVED",
      "STORAGE_CLASS_REFERENCE_UNRESOLVED",
      "OPENSHIFT_SERVER_SIDE_DRY_RUN_MISSING",
      "LIVE_DEPENDENCY_CONNECTIVITY_MISSING"
    ],
    "state": "blocked"
  },
  "architecture": "linux/amd64",
  "artifactSetDigest": "sha256:b59db076514f87b1251d069e5637badc21940aaf9cb729f49ab17f0058b4a46e",
  "artifactSetId": "orchestra-sno-trial-dependency-artifacts-2026-07-28.2",
  "bindings": {
    "dependencyAdmissionDigest": "sha256:73282faf172793398120509087930691e362f2290d4b60cc7f13ef4f99bf4219",
    "dependencyBomDigest": "sha256:fabec47064381d067ca759ba99c47470cc66628ecaacd2e0521f50bb29aad5dc"
  },
  "claims": {
    "campaignEvidence": false,
    "contractualSla": false,
    "customerCertified": false,
    "highAvailability": false,
    "productionSupported": false,
    "redHatCertified": false,
    "referenceProfileVerified": false,
    "rpoRtoVerified": false
  },
  "containers": [
    {
      "id": "valkey-image",
      "indexDigest": "sha256:8e8d64b405ce18f41b8e5ee20aa4687a8ed0022d1298f2ce31cdcf3a76e09411",
      "license": "BSD-3-Clause",
      "platform": "linux/amd64",
      "platformDigest": "sha256:64f6e8025b9a798061c8c79e73a7a79dbc8cca437e6af682e9f7605ff334615d",
      "resolvedReference": "docker.io/valkey/valkey@sha256:64f6e8025b9a798061c8c79e73a7a79dbc8cca437e6af682e9f7605ff334615d",
      "runtimeCompatibility": {
        "arbitraryUidRequired": true,
        "fixedUidAllowed": false,
        "readOnlyRootFilesystemRequired": true,
        "requiredWritablePaths": [
          "/data"
        ],
        "serviceAccountTokenAutomount": false
      },
      "serviceId": "valkey",
      "sourceReference": "docker.io/valkey/valkey:9.1.0",
      "sourceRevision": null,
      "sourceUrl": "https://github.com/valkey-io/valkey",
      "upstreamVerification": {
        "identityPolicy": null,
        "method": "reviewed-exception",
        "status": "pending"
      },
      "version": "9.1.0"
    },
    {
      "id": "model-backend-image",
      "indexDigest": "sha256:a576442ad3649c0b5ea74e20ad29a17c121117f32607cfe59ff27cc38066f874",
      "license": "MIT",
      "platform": "linux/amd64",
      "platformDigest": "sha256:7a670b0633a2b33d915ca958fc1e4977334924590c9bd5ffc9d4813dd168d77b",
      "resolvedReference": "ghcr.io/ggml-org/llama.cpp@sha256:7a670b0633a2b33d915ca958fc1e4977334924590c9bd5ffc9d4813dd168d77b",
      "runtimeCompatibility": {
        "arbitraryUidRequired": true,
        "fixedUidAllowed": false,
        "readOnlyRootFilesystemRequired": true,
        "requiredWritablePaths": [],
        "serviceAccountTokenAutomount": false
      },
      "serviceId": "model-backend",
      "sourceReference": "ghcr.io/ggml-org/llama.cpp:server",
      "sourceRevision": "88b47a755c72fed4b22fba0fd262e2d7b7d01583",
      "sourceUrl": "https://github.com/ggml-org/llama.cpp",
      "upstreamVerification": {
        "identityPolicy": null,
        "method": "reviewed-exception",
        "status": "pending"
      },
      "version": "b10143"
    }
  ],
  "controls": {
    "allowedCertificationSlots": [],
    "argocdApplicationsEmitted": false,
    "artifactBytesStored": false,
    "campaignEligible": false,
    "cloudMutationAuthorized": false,
    "deploymentAuthorized": false,
    "kustomizationReferenced": false,
    "manifestsEmitted": false,
    "productionDependencyProfileMutated": false,
    "runtimeModelDownloadAllowed": false,
    "scope": "sno-engineering-trial-dependency-artifacts-only",
    "secretValuesStored": false,
    "sourceOnly": true,
    "workloadCandidateMutated": false
  },
  "executionMode": "source-only",
  "kind": "orchestra.openshift.sno-trial-dependency-artifact-set.v1",
  "models": [
    {
      "chatRequired": true,
      "digest": "sha256:74a4da8c9fdbcd15bd1f6d01d621410d31c6fc00986f5eb687824e7b93d7a9db",
      "embeddingQualityCertifying": false,
      "filename": "qwen2.5-0.5b-instruct-q4_k_m.gguf",
      "format": "gguf",
      "id": "orchestra-reference-cpu-model",
      "immutableUrl": "https://huggingface.co/Qwen/Qwen2.5-0.5B-Instruct-GGUF/resolve/9217f5db79a29953eb74d5343926648285ec7e67/qwen2.5-0.5b-instruct-q4_k_m.gguf",
      "license": "Apache-2.0",
      "materialization": "operator-prestaged-read-only-pvc",
      "maximumAllowedBytes": 4294967296,
      "mountPath": "/models/qwen2.5-0.5b-instruct-q4_k_m.gguf",
      "provider": "Qwen",
      "quantization": "Q4_K_M",
      "repository": "Qwen/Qwen2.5-0.5B-Instruct-GGUF",
      "revision": "9217f5db79a29953eb74d5343926648285ec7e67",
      "runtimeDownloadAllowed": false,
      "servedModelId": "orchestra-reference-cpu",
      "serviceId": "model-backend",
      "sizeBytes": 491400032
    }
  ],
  "profileId": "orchestra-ocp-sno-trial-amd64-v1",
  "runtimeBinding": {
    "authentication": "api-key-file",
    "containerId": "model-backend-image",
    "healthPath": "/health",
    "modelId": "orchestra-reference-cpu-model",
    "modelInventoryPath": "/v1/models",
    "port": 8000,
    "protocol": "openai-compatible-https",
    "startupArguments": [
      "--model",
      "/models/qwen2.5-0.5b-instruct-q4_k_m.gguf",
      "--alias",
      "orchestra-reference-cpu",
      "--host",
      "0.0.0.0",
      "--port",
      "8000",
      "--ctx-size",
      "2048",
      "--parallel",
      "1",
      "--api-key-file",
      "/var/run/secrets/orchestra-model/api-keys",
      "--ssl-key-file",
      "/var/run/secrets/orchestra-model/tls.key",
      "--ssl-cert-file",
      "/var/run/secrets/orchestra-model/tls.crt"
    ],
    "tls": "operator-secret-files"
  },
  "schemaVersion": 1,
  "targetClass": "engineering-trial"
}
